{
  "schema": "epistates/preflight-result/v1",
  "task_id": "e1-contracts",
  "run_id": "run-001",
  "attempt_id": "attempt-001",
  "task_card_digest": "sha256:c14c033bd0e001a4db801f99e5ab60dc75dee7c4ca597305740124e95113d3c9",
  "adapter_digest": "sha256:5427ac8135d2d16e813e2104a17aad11bb2cd4e133b3e4fea6994a103bde56bd",
  "adapter_id": "opencode-tmux",
  "observed_at": "2026-08-11T18:00:00Z",
  "outcome": "blocked",
  "reasons": ["branch_drift", "dirty"],
  "observed": {
    "observed_repository": "epistates",
    "observed_worktree": "/workspace/epistates",
    "observed_cwd": "/workspace/epistates",
    "observed_branch": "codex/other",
    "observed_sha": "7521eed0000000000000000000000000000000000",
    "worktree_clean": false,
    "observed_session_name": "epistates-opencode",
    "pane_alive": true,
    "observed_command": "idle",
    "observed_platform": "darwin"
  }
}
